Study	Link:	Publication Year:	Species:	Temperature:	Brain Location (In situ vs ex situ vs other):	Initial preservation:	General microscopy method:	Immunostaining primarily:	Visualization method specifics:	Brain Region:	Cell Type:	Time Point:	Structural Feature:	Additional outcome specifier, if any:	Decomposition outcome:	Pilot Round?	Pilot Grade:	Decomposition Grade - Grader 1:	Decomposition Grade - Grader 2:	Random choice for multiple grades from grader 2:	Decomposition Grade - Grader 3:	Consensus grade:
Airaksinen 1991	https://pubmed.ncbi.nlm.nih.gov/1719449/	1991	Rat	2 hours at RT, then stored at 4°C	In situ	Immersion fixation	Light microscopy	Yes, immunostaining primarily	Immunostaining for histamine	Not recorded	Not recorded	48 hours	General cell membrane	0 hour PMI controls were perfusion fixed, compared to immersion fixed brains after the PMI.	"The number of histamine-IR cell bodies found in rats RI and R2 was the same as in the perfusion-fixed controls. Most of the cell bodies were strongly immunoreactive, whereas some of the cells (about 20%) were moderately immunoreactive, while still clearly visible against the immunonegative background (data not shown). The pattern of histamine-IR fibers in the rats RI and R2 was similar, and like that in the perfusion-fixed controls."	No	NA	1	0	0	NA	0
Anderson 1996	https://pubmed.ncbi.nlm.nih.gov/8774439/	1996	Human	Room temperature	Ex situ, in a humified chamber	Immersion fixation	Light microscopy	Yes, immunostaining primarily	Immunostaining for terminal deoxynucleotidyl transferase (tdt) 	Frontal cortex	Neuron	24 hours	General cell membrane		"At 24 hr PMD, a large increase in the number of TdT-positive cells and dense process staining was evident. Numerous large and small accumulations of TdT labeling were present in the neuropil. These areas could reflect TdT labeling attributable to cell lysis, caused by either postmortem necrosis or secondary necrosis in apoptotic cells. At this time point, the quality of cellular TdT labeling appeared more homogeneous and agranular or diffuse than that observed earlier, although what we have termed apoptotic-like nuclei based on morphological characteristics were still present. Many of the labeled pyramidal-type cells in layers III and V appeared to be increased in size." Also Figure 5. 	No	NA	1	2-3	2	NA	2
Ansari 1975	https://pubmed.ncbi.nlm.nih.gov/51045/	1975	Cow	23°C	Ex situ	Immersion fixation	Electron microscopy	No	Stained with osmium tetroxide, uranyl acetate, and lead citrate	Occipital lobe	Oligodendrocyte	24 hours	Myelin 		"Electron micrograph from unfrozen bovine brain incubated for 24 h at 23°C showing abundant dense-line material and mostly compact myelin lamellae. There is, however, spotty lamellar separation (arrow), a feature not seen in the unincubated material." Also Figure 5. 	No	NA	1	1	1	NA	1
Ansari 1976b	https://pubmed.ncbi.nlm.nih.gov/62823/	1976	Human	Room temperature	Ex situ 	Immersion fixation	Electron microscopy	No	Stained with osmium tetroxide, uranyl acetate, and lead citrate	White matter	Oligodendrocyte	2 hours	Myelin		"On electron microscopic examination, white matter that was incubated for 2 h at room temperature prior to fixation, showed sporadic areas of lamellar separation, a feature not seen in the unincubated material. This lamellar separation was similar to but not as extensive as that described earlier in white matter obtained at autopsy performed 8 h after death (2). No lamellar fragmentation or morphological alteration in dense-line material that could be attributed to incubation was seen." ... "Electron microscopic examination of the surgical material that was incubated for 2 h showed lamellar separation along the interperiod line but no accompanying lamellar fragmentation was detected. These findings are similar to those described in unincubated autopsy material (2). In this autopsy material that showed lamellar separation but no lamellar fragmentation, subsequent incubations did not result in any detectable loss of BP. These observations with surgical and autopsy material would lend support to the postulated location of BP along the cytoplasmic surface of myelin lamellae (9). BP located in this area would not be exposed to extracellular acid proteinases by lamellar separation alone. An actual break in the continuity of myelin lamellae would be necessary in order for the proteinases to gain access to BP in this location."	No	NA	1	1	1	NA	1
Arsénio-Nunes 1973	https://pubmed.ncbi.nlm.nih.gov/4272709/	1973	Cat	Room temperature	In situ	Perfusion fixation	Electron microscopy	No	Morphological staining with osmium and uranyl acetate	Sensorimotor cortex	Multiple or no clear focus	30 minutes	General cell membrane		"At the end of cerebral ischaemia of 30 min, the most preeminent finding was a considerable enlargement of both glial and neuronal processes in the molecular layer (Fig.2a). In spite of the swelling, the mitochondria, the myelin sheaths and the synapses were intact. An occasional swelling of some processes of the neuropil was also observed in the other areas of the cortex, but these alterations were much less pronounced than in the molecular layer". At 90 minutes PMI, severe swelling of astrocyte processes in the molecular and second layer. "In the animals without blood recirculation after ischaemia a severe swelling of cell processes in the molecular (Fig.6a) and the second layer was observed. In contrast to ischaemia of 30 min, the mitochondria were frequently damaged. They appeared to be swollen and in some of them, the intramitochondrial cristae were broken. In the other layers of the cortex, swelling of the perikarya of the astrocytes and their perivascular processes, and of the profiles in the neuropil was frequently encountered. The neurons, on the other hand, were relatively preserved; the only change being an enlargement of the endoplasmic reticulum. The capillaries including the basement membrane were generally intact, and pinocytic vesicles were less frequently encountered than at the end of 30 min of ischaemia." Also Figure 3a and Figure 6a. 	No	NA	1	1	1	NA	1
Arsénio-Nunes 1973	https://pubmed.ncbi.nlm.nih.gov/4272709/	1973	Cat	Room temperature	In situ	Perfusion fixation	Electron microscopy	No	Morphological staining with osmium and uranyl acetate	Sensorimotor cortex	Multiple or no clear focus	90 minutes	Capillaries		"The capillaries including the basement membrane were generally intact, and pinocytic vesicles were less frequently encountered than at the end of 30 min of ischaemia."	No	NA	1	1	1	NA	1
Arslan 2004	https://pubmed.ncbi.nlm.nih.gov/15559421/	2004	Multiple mammalian species	Room temperature	Ex situ	Immersion fixation	Light microscopy	No	Morphologically stained with hematoxylin and eosin	Not recorded	Multiple or no clear focus	168 hours	General cell membrane		"The degree of autolysis observed in the brain tissues that had been stored at room temperature for two, four or seven days was slight, moderate and severe; in the tissues stored for seven days the neurons and other structural components, such as glial cells and vessels, were completely lysed"	No	NA	3	3	3	NA	3
Averback 1980	https://pubmed.ncbi.nlm.nih.gov/7400879/	1980	Rat	Room temperature	In situ	Perfusion fixation	Light microscopy	No	Morphologically stained with thionin	Cerebellum	Granule cell	2 hours	Cell counts		Per Table, 2 hours is the first time point at which there appears to be a significant decrease in measured granule cell counts. "As depicted in the fig., measured cell densities have a clear relation with logarithm of time over the first 24 hr. The mean cellular sectional area shows no significant trend over time; likewise the thickness of the boundaries of the granule cell layer is not diminished after 21 hr (table)." ... "Within the 18-40ºC range, in-situ and in-vitro preparations of human and rat show no difference in effect or time trend (Averback, unpublished observations)"	No	NA	3	2	2	NA	2
Averback 1980	https://pubmed.ncbi.nlm.nih.gov/7400879/	1980	Rat	Room temperature	In situ	Perfusion fixation	Light microscopy	No	Morphologically stained with thionin	Cerebellum	Purkinje cell	24 hours	General cell membrane		"Purkinje cells show advanced degeneration after 24 hr, but serial measurements on all detected tangential patches reveal no evidence of disappearance."	No	NA	2	2	2	NA	2
Babb 1988	https://pubmed.ncbi.nlm.nih.gov/3209750/	1988	Rat	Room temperature	In situ	Immersion fixation	Light microscopy	Yes, immunostaining primarily	Immunostaining for GAD (Glutamate Decarboxylase)	Hippocampus	Neuron	4 hours	General cell membrane 		"GAD molecules apparently diffused into cell bodies, axons, and dendrites, where GAD is not so fully distributed". Also Figure 2. 	No	NA	2	1	1	NA	1
Babb 1988	https://pubmed.ncbi.nlm.nih.gov/3209750/	1988	Rat	Room temperature	In situ	Immersion fixation	Electron microscopy	Yes, immunostaining primarily	Immunostaining for GAD along with osmium tetroxide staining	Hippocampus	Neuron	30 minutes	Synapse		"Note that even with a 30-minute delay after death and immersion fixation, there is preservation of GAD-IR mitochondria, vesicles, and cytoplasmic organelles comparable to those with intravital perfusion fixation". Also Figure 5. 	No	NA	0	0	0	NA	0
Badonič 1992	https://europepmc.org/article/med/1303105	1992	Dog	Not recorded	In situ	Not recorded	Light microscopy	No	Stained with 1% methylene blue	Frontal cortex	Neuron	3 hours	General cell membrane		"In the material of experimental animals some changes could be observed after 3 hours in the half-thin slices. These changes are typical for common autolysis. In the cells the nuclei and nucleoli were present, too. However, the nuclei were obviously hyperchromatic and homogenous. In the neuroplasm there were small isolated vacuoles, yet granules of the Nissl substance could not be identified (Fig. 2); certain “triangulation” of some neurons could be observed as well. Light arteficial spaces were visible around the neurons."	No	NA	2	1	1	NA	1
Blair 2016	https://pubmed.ncbi.nlm.nih.gov/26982086/	2016	Human	After autopsy, 4°C	Ex situ	Immersion fixation	Light microscopy	No	Nissl stain (cresyl violet) 	Hippocampus	Neuron	46.5 hours	General cell membrane	Median longest PMI across the case series.	"Morphologically, minimal tissue or cellular changes are noted with increased PMI by Nissl stain ... The tissue samples fixed after the initial PMI and then up to an additional 49 h at 4°C exhibited no striking changes in neuronal morphology using routine Nissl stain"	No	NA	0	0	0	NA	0
Blair 2016	https://pubmed.ncbi.nlm.nih.gov/26982086/	2016	Human	After autopsy, 4°C	Ex situ	Immersion fixation	Light microscopy	Yes, immunostaining primarily	Immunostaining for NeuN	Hippocampus	Neuron	46.5 hours	General cell membrane	Median longest PMI across the case series.	"Immunostaining Case E shows that both pyramidal neurons and dentate gyrus neurons show the expected neuronal localization of NeuN at all PMI times... the variation of NeuN immunostaining and immunblotting between the two cases shown in Fig 1 likely represent individual patient variability and disease state, and not PMI, as has been suggested previously"	No	NA	0	0	0	NA	0
Blair 2016	https://pubmed.ncbi.nlm.nih.gov/26982086/	2016	Human	After autopsy, 4°C	Ex situ	Immersion fixation	Light microscopy	Yes, immunostaining primarily	Immunostaining for α-tubulin	Hippocampus	Neuron	46.5 hours	Axon	Median longest PMI across the case series.	"Axonal processes of neurons remained immunoreactive for α-tubulin after 48 h in 3/6 cases (Fig 2A), and neurofilament proteins were still readily detectable with extended PMI, though some loss of intensity is apparent ... Neuronal cell bodies and processes are immunostained using antibodies to alpha tubulin and neurofilament proteins even at longer PMI times"	No	NA	1	0-1	1	NA	1
Blair 2016	https://pubmed.ncbi.nlm.nih.gov/26982086/	2016	Human	After autopsy, 4°C	Ex situ	Immersion fixation	Light microscopy	Yes, immunostaining primarily	Immunostaining for neurofilament	Hippocampus	Neuron	46.5 hours	Axon	Median longest PMI across the case series.	"Axonal processes of neurons remained immunoreactive for α-tubulin after 48 h in 3/6 cases (Fig 2A), and neurofilament proteins were still readily detectable with extended PMI, though some loss of intensity is apparent ... Neuronal cell bodies and processes are immunostained using antibodies to alpha tubulin and neurofilament proteins even at longer PMI times"	No	NA	1	1	1	NA	1
Blair 2016	https://pubmed.ncbi.nlm.nih.gov/26982086/	2016	Human	After autopsy, 4°C	Ex situ	Immersion fixation	Light microscopy	Yes, immunostaining primarily	Immunostaining for GFAP	Hippocampus	Astrocyte	46.5 hours	General cell membrane	Median longest PMI across the case series.	"GFAP is one of the common markers for astrocytosis. Immunocytochemistry with a GFAP antibody did not show significant changes in astrocyte staining with increased PMI... For instance, GFAP, a marker protein for astrocytes, is unaffected by increased PMI."	No	NA	0	0	0	NA	0
Blair 2016	https://pubmed.ncbi.nlm.nih.gov/26982086/	2016	Human	After autopsy, 4°C	Ex situ	Immersion fixation	Light microscopy	Yes, immunostaining primarily	Immunostaining for collagen IV	Hippocampus	Endothelial cell 	46.5 hours	Basement membrane	Median longest PMI across the case series.	"In addition, an antibody to collagen IV showed equivalent staining intensity of vessels even at the longest PMI... Overall tissue morphology is maintained such that neuronal structures and the vasculature are not disrupted."	No	NA	0	0	0	NA	0
Boekhoorn 2006	https://pubmed.ncbi.nlm.nih.gov/16814555/	2006	Rat	Room temperature	In situ	Immersion fixation	Light microscopy	Yes, immunostaining primarily	Immunostaining for doublecortin	Hippocampus	Neuron	1 hour	Dendrite		"In tissue obtained from perfused brains, DCX IR was strongly expressed throughout the SGZ, where it extensively labeled neuronal cell bodies as well as their dendrites (Fig. 8B), traversing the GCL and reaching into the molecular layer (Fig. 8A). After 1 h of PMD, a clear reduction was already apparent in DCX IR. The reduction was particularly apparent in the dendritic component (Figs. 8C, D and F), showing further progression with increased PMD. Furthermore, weaker soma staining was detectable (Figs. 8D and G) at 8 and 12 h of PMD"	No	NA	2	1	1	NA	1
Boekhoorn 2006	https://pubmed.ncbi.nlm.nih.gov/16814555/	2006	Rat	Room temperature	In situ	Immersion fixation	Light microscopy	Yes, immunostaining primarily	Immunostaining for doublecortin	Hippocampus	Neuron	8 hours	Dendrite		"Representative illustration of a DCX-positive neuron in the rat dentate gyrus (immersion fixed) after a 1 h postmortem delay. A prominent reduction in immunoreactivity is apparent, not only in the soma, but even more so in the dendrites. (D) DCX immunoreactivity of a rat brain with a PMD of 8 h, showing only some DCX staining of the soma (arrows) remaining in the GCL, yet very little, if any, dendritic staining remains present. *"	No	NA	3	2	2	NA	2
Boekhoorn 2006	https://pubmed.ncbi.nlm.nih.gov/16814555/	2006	Rat	Room temperature	In situ	Immersion fixation	Light microscopy	Yes, immunostaining primarily	Immunostaining for doublecortin	Hippocampus	Neuron	1 hour	Soma		"In tissue obtained from perfused brains, DCX IR was strongly expressed throughout the SGZ, where it extensively labeled neuronal cell bodies as well as their dendrites (Fig. 8B), traversing the GCL and reaching into the molecular layer (Fig. 8A). After 1 h of PMD, a clear reduction was already apparent in DCX IR. The reduction was particularly apparent in the dendritic component (Figs. 8C, D and F), showing further progression with increased PMD. Furthermore, weaker soma staining was detectable (Figs. 8D and G) at 8 and 12 h of PMD"	No	NA	1	1	1	NA	1
Boekhoorn 2006	https://pubmed.ncbi.nlm.nih.gov/16814555/	2006	Rat	Room temperature	In situ	Immersion fixation	Light microscopy	Yes, immunostaining primarily	Immunostaining for doublecortin	Hippocampus	Neuron	12 hours	Soma		"At 12 h PMD, DCX soma staining is very weak in rat brain, while an additional, granular staining pattern is apparent in the SGZ and hilus (arrows). "	No	NA	2	2	2	NA	2
Boekhoorn 2006	https://pubmed.ncbi.nlm.nih.gov/16814555/	2006	Rat	Room temperature	In situ	Immersion fixation	Light microscopy	Yes, immunostaining primarily	Immunostaining for doublecortin	Hippocampus	Neuron	44 hours	Soma		"At 12 h of PMD, most DCX-positive cells in the SGZ had further shrunken in size, whereas a smaller amount of cells was detectable at a PMD of 44 h."	No	NA	3	2-3	2	NA	2
Bywater 1962	https://pubmed.ncbi.nlm.nih.gov/14017520/	1962	Rhesus monkey	Room temperature	In situ	Perfusion fixation	Light microscopy	No	Silver staining	Multiple or no clear focus	Multiple or no clear focus	20 minutes	General cell membrane		"On the other hand it must be emphasized that perfusion should always be attempted, and that perfusion 20 minutes after death shows only minute changes and is hardly distinguishable from material perfused immediately (after death). It proves that the changes which must occur within the first 20 minutes are at submicroscopical level for they can be revealed with the electron microscope but are not yet discernible with our ordinary methods of microscopy."	No	NA	0	0	0	NA	0
Bywater 1962	https://pubmed.ncbi.nlm.nih.gov/14017520/	1962	Rhesus monkey	Room temperature	In situ	Perfusion fixation	Light microscopy	No	Silver staining	Multiple or no clear focus	Multiple or no clear focus	1 hour	General cell membrane		"For practical reasons it must be emphasized that a post mortem interval of 1 hour followed by perfusion shows such artefacts which are comparable to those found in material immersed immediately after death." ... "The difference between perfused and immersed material is very obvious due to the considerable shrinkage of neurons which in turn leads to a heavy impregnation of the cell and the appearance of a pericellular space. This in turn causes the retraction of the cell body from pericellular structures which makes synaptic studies difficult to execute. The differences of neuronal structure when perfused or immersed can be easily judged when comparing Fig. 5 with Fig 3. Fig.5 exhibits too-heavily impregnated motor neurons, wide pericellular spaces and the detachment of pericellular structures, and the concave outline of the cell is clearly shown." 	No	NA	1	1	1	NA	1
Bywater 1962	https://pubmed.ncbi.nlm.nih.gov/14017520/	1962	Rhesus monkey	Room temperature	In situ	Immersion fixation	Light microscopy	No	Silver staining	Multiple or no clear focus	Multiple or no clear focus	4.5 hours	General cell membrane		"Figs 6 & 7 illustrate the progress in autolytic changes caused by a post mortem interval of 4.5 hours. At this stage gross distortion of neurons, large pericellular spaces and the occurence of vacuoles inside the cell are striking." ... "Showing shrinkage of Betz cells (left), and of a ventral horn cell (right). At this stage the dendrites begin to curl up in a corkscrew manner". Also Figure 7 	No	NA	2	3	3	NA	3
Cammermeyer 1978	https://pubmed.ncbi.nlm.nih.gov/97249/	1978	Multiple species, including rat, rabbit, cat, dog, and monkey	Room temperature	In situ	Perfusion fixation	Light microscopy	No	Multiple morphological stains	Multiple or no clear focus	Neuron	5 minutes	General cell membrane		"The flow of an adequate amount of saline to flush the blood vessels, as judged by the clear appearance of the fluid escaping from the right auricle, takes approximately one minute, and the flow time for Bouin's solution is a little longer. Under these circumstances the entire procedure is terminated in 3-5 rain. If the time of action of the fixative is delayed, numerous solitary dark neurons may develop, as observed when the flow of saline is delayed 5 or 10 min intentionally, or it is prolonged because of obstruction of blood vessels with air emboli, lowering of the perfusion bottles, or introduction of excessive amounts of saline."	No	NA	2	1	1	NA	1
Choe 1995	https://pubmed.ncbi.nlm.nih.gov/7558730/	1995	Dog	Not recorded	In situ	Immersion fixation	Electron microscopy	No	Stained with osmium tetroxide, uranyl acetate, and lead citrate	Ventral anterior nucleus of the thalamus	Neuron	1 hour	General cell membrane		"Electron microscopic findings 1 hour after death included (Figure 6) nuclear pyknosis and perikaryal condensation, undulatory nuclear membrane, several cytoplasmic vacuoles, swollen mitochondria, and dilated endoplasmic reticulum." 	No	NA	1	1	1	NA	1
Choe 1995	https://pubmed.ncbi.nlm.nih.gov/7558730/	1995	Dog	Not recorded	In situ	Immersion fixation	Electron microscopy	No	Stained with osmium tetroxide, uranyl acetate, and lead citrate	Ventral anterior nucleus of the thalamus	Neuron	24 hours	General cell membrane		"Cytoplasm was filled with very large vacuoles. Cellular organelles were destroyed completely." Also Figure 8 	No	NA	2	2	2	NA	2
Choe 1995	https://pubmed.ncbi.nlm.nih.gov/7558730/	1995	Dog	Not recorded	In situ	Immersion fixation	Electron microscopy	No	Stained with osmium tetroxide, uranyl acetate, and lead citrate	Ventral anterior nucleus of the thalamus	Neuron	1 hour	Myelin		"The myelin sheaths appeared to be irregular, with concentric unravelling" 	No	NA	1	1	1	NA	1
Choe 1995	https://pubmed.ncbi.nlm.nih.gov/7558730/	1995	Dog	Not recorded	In situ	Immersion fixation	Electron microscopy	No	Stained with osmium tetroxide, uranyl acetate, and lead citrate	Ventral anterior nucleus of the thalamus	Neuron	24 hours	Myelin		"Myelin sheaths show wide areas of network-like formations with marked degeneration." Also Figure 8 	No	NA	2	3	3	NA	3
D'Andrea 2017	https://pubmed.ncbi.nlm.nih.gov/28766965/	2017	Rat	4°C	Ex situ	Immersion fixation	Light microscopy	Yes, immunostaining primarily	Immunostaining for MAP2	Cerebrum	Neuron	2 hours	General cell membrane		"Arrows shows MAP2-positive neurons without apparent MAP2-positive dendritic processes." ... "By contrast to the radial orientation of the MAP2-positive neuronal dendrites in the routinely fixed cortical rat brains (Fig. 1), the patterns of the MAP2 immunolabeling in the under-fixed and delayed-fixed cortical rat brains lacked normal cortical architecture (Figs. 2 and 3); the neurons appeared degenerative and extended MAP2-positive processes were absent. Some of the neurons had prominent MAP2 immunolabeling in the perikaryon as if the MAP2 that was in the extended dendritic processes had relocated to the cell body (arrows). The neurons also appeared detached from each other to form isolated cells surrounded by empty spaces. We also assessed the average intensity of MAP2 immunolabeling using a semiquantitative scoring system (Fig. 4). The average intensity of MAP2 immunolabeling in the fixed tissues was moderate to strong (2.5−3.0) and relatively consistent. By contrast, the average intensity of MAP2 immunolabeling in the unfixed and delayed-fixed tissues was negative to weak." Also Figure 3	No	NA	3	2	2	NA	2
D'Andrea 2017	https://pubmed.ncbi.nlm.nih.gov/28766965/	2017	Rat	4°C	Ex situ	Immersion fixation	Light microscopy	Yes, immunostaining primarily	Immunostaining for MBP	Cerebrum	Oligodendrocyte	48 hours	General cell membrane		"By contrast to our observations for MAP2, the distribution and intensity of the MBP appeared to be unaffected by the various fixation conditions." ... "Moderate to strong MBP immunolabeling was detected consistently in all immediately fixed, unfixed, and delayed-fixed tissues. We observed similar results for GFAP immunolabeling in the same CNS tissues (data not shown)." Also Figure 7	No	NA	0	0	0	NA	0
D'Andrea 2017	https://pubmed.ncbi.nlm.nih.gov/28766965/	2017	Rat	4°C	Ex situ	Immersion fixation	Light microscopy	Yes, immunostaining primarily	Immunostaining for GFAP	Cerebrum	Astrocyte	48 hours	General cell membrane		"By contrast to our observations for MAP2, the distribution and intensity of the MBP appeared to be unaffected by the various fixation conditions." ... "Moderate to strong MBP immunolabeling was detected consistently in all immediately fixed, unfixed, and delayed-fixed tissues. We observed similar results for GFAP immunolabeling in the same CNS tissues (data not shown)."	No	NA	0	0	0	NA	0
Dachet 2021	https://pubmed.ncbi.nlm.nih.gov/33758256/	2021	Human	24°C	Ex situ	Immersion fixation	Light microscopy	No	Morphologically stained with hematoxylin and eosin	Temporal lobe	Neuron	2 hours	General cell membrane		"At 2 h, we observed a decrease of nuclear staining for NeuN and neuronal swelling." Also Figure 4	Yes	1	1	NA	NA	NA	1
Dachet 2021	https://pubmed.ncbi.nlm.nih.gov/33758256/	2021	Human	24°C	Ex situ	Immersion fixation	Light microscopy	Yes, immunostaining primarily	Immunostaining for NeuN	Temporal lobe	Neuron	24 hours	General cell membrane		"Between 4–8 h a majority of the neurons were swollen with a marked reduction in nuclear NeuN staining and by 12 h the neurons demonstrated loss of nuclear detail on H&E and NeuN staining was markedly reduced. At 24 h staining by NeuN showed that a majority of neurons were degraded." Also Figure 4	Yes	3	3	NA	NA	NA	3
Dachet 2021	https://pubmed.ncbi.nlm.nih.gov/33758256/	2021	Human	24°C	Ex situ	Immersion fixation	Light microscopy	Yes, immunostaining primarily	Immunostaining for CD68	Temporal lobe	Microglia	12 hours	Microglia process		"[B]etween 2–4 h microglia became activated with increased process outgrowth peaking at 12 h." Also Figure 4	Yes	2	2	NA	NA	NA	2
